{
  "name": "WPReminder",
  "slug": "wp-reminder",
  "version": "0.1.0",
  "type": "plugin",
  "author": {
    "name": "CodeLeaf",
    "email": "plugins@code-leaf.de"
  },
  "build": {
    "includes": [
      "dist/fonts",
      "dist/css",
      {"dist/js/*.js": "dist/js"},
      {"dist/js/*.php": "dist/js"},
      "languages",
      "plugin",
      "schemas",
      "composer.json",
      "composer.lock",
      "wp-reminder.php"
    ]
  }
}